node_id,entity_type,name,name_norm,is_registry,first_seen_chunk,first_seen_source,first_seen_page,example_evidence,chunk_count,surface_forms,is_generic,country,country_full
ent:231e99557d92237b,Authority,Alliance for Sustainable Building Products,alliance for sustainable building products,False,71.The_Reuse_Playbook_-_Circular_Buildings_Toolkit::c85::4e9272121fad372f,71.The Reuse Playbook - Circular Buildings Toolkit.pdf,,"Delivering Innovative Steel ReUse ProjecT (DISRUPT) initiative, led by the Alliance for Sustainable Building Products (ASBP)",1,Alliance for Sustainable Building Products,False,AU,Australia
ent:466487bec0729b57,Authority,"American Society of Heating, Refrigerating and Air-Conditioning Engineers",american society of heating refrigerating and air-conditioning engineers,True,71.The_Reuse_Playbook_-_Circular_Buildings_Toolkit::c186::0ef175c84689f556,71.The Reuse Playbook - Circular Buildings Toolkit.pdf,,"American Society of Heating, Refrigerating and Air-Conditioning Engineers. Sustainability Roadmap. American Society of Heating, Refrigerating and Air-Conditioning Engineers, 2006.",1,"American Society of Heating, Refrigerating and Air-Conditioning Engineers",False,AU,Australia
ent:a41f453e3868e1af,Authority,Arup,arup,True,71.The_Reuse_Playbook_-_Circular_Buildings_Toolkit::c38::884474d23840360e,71.The Reuse Playbook - Circular Buildings Toolkit.pdf,,Invest in Arup The Reuse Playbook,6,Arup,False,AU,Australia
ent:85e22a6c83d09ca7,Authority,Australian Building Codes Board,australian building codes board,True,62.Integrating_the_circular_economy_into_construction_waste_management_in_NSW_Australia::c150::c59830b35eb1d847,"62.Integrating the circular economy into construction waste management in NSW, Australia.pdf",,"Standards, 2022; Australian Building Codes Board, 2022",1,Australian Building Codes Board,False,AU,Australia
ent:474afa6d04178216,Authority,Australian Bureau of Statistics,australian bureau of statistics,False,48.What-Works-3-For-circular-design-in-the-built-environment::c14::b75739ee1d04464b,48.What-Works-3-For-circular-design-in-the-built-environment.pdf,,"Waste Account, Australia, Experimental Estimates, 2018-19 financial year | Australian Bureau of Statistics (abs.gov.au)",1,Australian Bureau of Statistics,False,AU,Australia
ent:4874da6880c04210,Authority,Australian Capital Territory (ACT),australian capital territory (act),True,44.The_Transition_to_a_Circular_Built_Environment_in_::c21::446785c9d3de410e,44.The_Transition_to_a_Circular_Built_Environment_in_.pdf,7.0,The ACT has specialised facilities for sorting C&D waste for use in building and road construction.,2,Australian Capital Territory (ACT),False,AU,Australia
ent:dbf680c44ccf304f,Authority,Australian Housing and Urban Research Institute Limited,australian housing and urban research institute limited,True,38.AHURI-Final-Report-402-Building-materials-in-a-circular-economy::c344::8ee0a51279786f96,38.AHURI-Final-Report-402-Building-materials-in-a-circular-economy.pdf,,"AHURI Final Report No. 281, Australian Housing and Urban Research Institute Limited, Melbourne",4,Australian Housing and Urban Research Institute Limited,False,AU,Australia
ent:7cadb739bc542ee4,Authority,Australian Institute of Architects,australian institute of architects,False,44.The_Transition_to_a_Circular_Built_Environment_in_::c34::c56e7ea2e809ad23,44.The_Transition_to_a_Circular_Built_Environment_in_.pdf,,Australian Institute of Architects. (2021). Institute Policy and advocacy statements: Sustainability policy,4,Australian Institute of Architects,False,AU,Australia
ent:73c37d4768db0461,Authority,Australian State and Territory Governments,australian state and territory governments,True,30.Australia_Construction_Demolition_Waste_Recycling_Market_Size_Share_Price_Growth_Forecast_2025-2033::c12::4db1187a73d0c573,"30.Australia Construction Demolition Waste Recycling Market Size, Share, Price, Growth, Forecast 2025-2033.pdf",8.0,"Australian states have introduced circular economy plans that focus on waste reduction, material recovery expansion, and innovation in recycling technologies.",1,Australian State and Territory Governments,False,AU,Australia
ent:b275c656ce4bf0e5,Authority,Bengt Dahlgren,bengt dahlgren,False,71.The_Reuse_Playbook_-_Circular_Buildings_Toolkit::c236::d75c4681996e1824,71.The Reuse Playbook - Circular Buildings Toolkit.pdf,,"Bengt Dahlgren. Återbruksguiden för Installationer. Bengt Dahlgren, 2022",2,Bengt Dahlgren,False,AU,Australia
ent:46cd0416bb6f51ae,Authority,Bradfield Development Authority,bradfield development authority,True,47.gbca-a-practical-guide-to-circular-procurement::c60::0d8e09154502aa98,47.gbca-a-practical-guide-to-circular-procurement.pdf,22.0,"First Building, NSW. Bradfield Development Authority. Targeting 6 Star Green Star – Buildings v1",1,Bradfield Development Authority,False,AU,Australia
ent:ecc2fa7b5f0b5307,Authority,Building Control,building control,True,41.Circular_Economy_Guidance_for_the_Irish_Construction_Sector_For_peer_review_5.9.2023_::c192::fb34d80ba2c2d00e,41.Circular Economy Guidance for the Irish Construction Sector (For peer review) (5.9.2023).pdf,80.0,Currently there is difficulty with building control and fire certification when reusing materials or using secondary products,1,Building Control,False,AU,Australia
ent:f89ad40bb3190245,Authority,Building Regulations Advisory Body,building regulations advisory body,False,41.Circular_Economy_Guidance_for_the_Irish_Construction_Sector_For_peer_review_5.9.2023_::c59::a93bc17b7f5d2c11,41.Circular Economy Guidance for the Irish Construction Sector (For peer review) (5.9.2023).pdf,,"Introduce a Building Regulations Advisory Body, consisting of member of various stakeholders, e.g., RIAI, Engineers Ireland",1,Building Regulations Advisory Body,False,AU,Australia
ent:dc7a063c9e5e4c0e,Authority,CEMAG,cemag,True,27.Engineering-for-Australias-Circular-Economy-White-Paper-Download::c50::10784bfe7c82b080,27.Engineering-for-Australias-Circular-Economy-White-Paper-Download.pdf,,"It indicates that a National Circular Framework, as recommended by CEMAG, could elevate lagging regions",2,CEMAG,False,AU,Australia
ent:11fa07dfd64e4afc,Authority,Centre,centre,True,48.What-Works-3-For-circular-design-in-the-built-environment::c26::88f3fac70863a372,48.What-Works-3-For-circular-design-in-the-built-environment.pdf,10.0,"The built environment has been a key focus area for the Centre, having funded a waste reducing prefabrication project",1,Centre,False,AU,Australia
ent:44c3963873afa3c4,Authority,Centre for Advanced Manufacturing of Prefabricated Housing,centre for advanced manufacturing of prefabricated housing,False,75.Case-Study-1-1-ATCO-SL::c37::02c4d6f5b1c0890d,75.Case-Study-1-1-ATCO-SL.pdf,,A University of Melbourne's Centre for Advanced Manufacturing of Prefabricated Housing report suggests,1,Centre for Advanced Manufacturing of Prefabricated Housing,False,AU,Australia
ent:a6f2687947ff4501,Authority,Chartered Institution of Building Services Engineers (CIBSE),chartered institution of building services engineers (cibse),True,71.The_Reuse_Playbook_-_Circular_Buildings_Toolkit::c236::d75c4681996e1824,71.The Reuse Playbook - Circular Buildings Toolkit.pdf,,Chartered Institution of Building Services Engineers. TM56: Resource Efficiency of Building Services. London,2,Chartered Institution of Building Services Engineers (CIBSE),False,AU,Australia
ent:15f8fd1db8b684ce,Authority,Circle Economy,circle economy,False,38.AHURI-Final-Report-402-Building-materials-in-a-circular-economy::c259::9d4b12e1927577ff,38.AHURI-Final-Report-402-Building-materials-in-a-circular-economy.pdf,,"Dufourmont, J. and Brown, E.G. (2020) Jobs and skills in the circular economy: state of play and future pathways, Circle Economy",2,Circle Economy,False,AU,Australia
ent:83b13f0a7bbf7295,Authority,Circular Economy Commissioner,circular economy commissioner,False,27.Engineering-for-Australias-Circular-Economy-White-Paper-Download::c78::fe03885cc993b702,27.Engineering-for-Australias-Circular-Economy-White-Paper-Download.pdf,,"Consider establishing a dedicated authority or commissioner to provide long-term, bipartisan stability similar to climate legislation models",1,Circular Economy Commissioner,False,AU,Australia
ent:ec615185d8da34a6,Authority,Circular Economy Ministerial Advisory Group (CEMAG),circular economy ministerial advisory group (cemag),True,27.Engineering-for-Australias-Circular-Economy-White-Paper-Download::c23::395d1c6de56f36e6,27.Engineering-for-Australias-Circular-Economy-White-Paper-Download.pdf,,Framework and the Circular Economy Ministerial Advisory Group (CEMAG)'s Circular Advantage recommendations,3,Circular Economy Ministerial Advisory Group (CEMAG),False,AU,Australia
ent:cba071c63907447f,Authority,Circular Flanders,circular flanders,True,23.The_Current_State_and_Digital_Evolution_of_the_Demolition_Industry_in_NSW_and_QLD_Australia::c83::9f30f0b35be8e491,"23.The Current State and Digital Evolution of the Demolition Industry in NSW and QLD, Australia.pdf",,the Sloopwijzer tool was part of a Circular Flanders initiative,1,Circular Flanders,False,AU,Australia
ent:d5817114ef917430,Authority,Commonwealth Scientific and Industrial Research Organisation (CSIRO),commonwealth scientific and industrial research organisation (csiro),True,38.AHURI-Final-Report-402-Building-materials-in-a-circular-economy::c15::e8a20228f2f1e974,38.AHURI-Final-Report-402-Building-materials-in-a-circular-economy.pdf,,The Commonwealth Scientific and Industrial Research Organisation (CSIRO) has made considerable progress in the development of a data system,3,Commonwealth Scientific and Industrial Research Organisation (CSIRO),False,AU,Australia
ent:531c2606da732a21,Authority,CSI,csi,False,38.AHURI-Final-Report-402-Building-materials-in-a-circular-economy::c259::9d4b12e1927577ff,38.AHURI-Final-Report-402-Building-materials-in-a-circular-economy.pdf,,ECRA and CSI (2017) Development of state of the art techniques in cement manufacturing: trying to look ahead,2,CSI,False,AU,Australia
ent:a3b317f8a9ebc85d,Authority,CSIRO,csiro,True,26.uilt_environment_sector_primed_to_take_on_circularity_report_finds::c1::f9fc293c8a3f8f4d,"26.uilt environment sector 'primed to take on circularity,' report finds.pdf",3.0,The report follows a CSIRO report that found Australia's circularity rate lags behind the rest of the world,4,CSIRO,False,AU,Australia
ent:ddff41e272e526f9,Authority,Danish Ministry of Environment and Gender Quality,danish ministry of environment and gender quality,True,49.RV_Circular-Economy-Market-Report-2025_2::c14::faf69b732080d6ae,49.RV_Circular-Economy-Market-Report-2025_2.pdf,8.0,Denmark (Danish Ministry of Environment and Gender Quality 2018),1,Danish Ministry of Environment and Gender Quality,False,AU,Australia
ent:2823bfd41f8dfccc,Authority,DECCW NSW,deccw nsw,True,22.national-waste-report-2020::c101::3333998b41bed3d4,22.national-waste-report-2020.pdf,35.0,buildings can be purposefully deconstructed to maximise reuse and recycling (DECCW NSW 2010),2,DECCW NSW,False,AU,Australia
ent:83b7af503d0c0625,Authority,"Department of Agriculture, Food & the Marine",department of agriculture food  the marine,True,41.Circular_Economy_Guidance_for_the_Irish_Construction_Sector_For_peer_review_5.9.2023_::c63::b4c349368bf2c58b,41.Circular Economy Guidance for the Irish Construction Sector (For peer review) (5.9.2023).pdf,,"Technical Guidance Document B - Fire Safety by a cross department/industry representative working group under Department of Agriculture, Food & the Marine",1,"Department of Agriculture, Food & the Marine",False,AU,Australia
ent:8446c691a2b56376,Authority,"Department of Agriculture, Water and the Environment (DAWE)",department of agriculture water and the environment (dawe),True,31.Are_Australian_Construction_and_Demolition_Waste_Management_Research_Efforts_Coherent_with_Policy_Targets::c9::1e319fb82ef42e8f,31.Are Australian Construction and Demolition Waste Management Research Efforts Coherent with Policy Targets.pdf,,"Department of Agriculture, Water and the Environment 2022",7,"Department of Agriculture, Water and the Environment (DAWE)",False,AU,Australia
ent:8686c7dcf22c4a00,Authority,"Department of Climate Change, Energy, the Environment and Water (DCCEEW)",department of climate change energy the environment and water (dcceew),True,50.Australia_s_circular_economy_Unlocking_the_oppertunities_Inquiry_report::c134::df4df66ac33bb85f,50.Australia’s circular economy Unlocking the oppertunities Inquiry report.pdf,,"The Australian Government Department of Climate Change, Energy, the Environment and Water (DCCEEW) is currently completing a statutory review",2,"Department of Climate Change, Energy, the Environment and Water (DCCEEW)",False,AU,Australia
ent:27a8196d93ce1c5b,Authority,Department of Finance,department of finance,True,40.CIOB_Response_to_DECC_Circular_Economy_Consultation::c4::90b3e9fdb49209b8,40.CIOB Response to DECC Circular Economy Consultation.pdf,2.0,"the guidance will spill over into the remit of other departments – the Department of Housing, Planning and Local Government, and the Department of Finance",1,Department of Finance,False,AU,Australia
ent:11555f5d765922fa,Authority,"Department of Housing, Local Government and Heritage",department of housing local government and heritage,True,40.CIOB_Response_to_DECC_Circular_Economy_Consultation::c4::90b3e9fdb49209b8,40.CIOB Response to DECC Circular Economy Consultation.pdf,2.0,"the guidance will spill over into the remit of other departments – the Department of Housing, Planning and Local Government, and the Department of Finance",3,"Department of Housing, Local Government and Heritage",False,AU,Australia
ent:17748330faaf531c,Authority,Department of Planning,department of planning,False,62.Integrating_the_circular_economy_into_construction_waste_management_in_NSW_Australia::c96::12eba1fd383f608e,"62.Integrating the circular economy into construction waste management in NSW, Australia.pdf",,"the NSW Waste Strategy (Department of Planning, 2021)",1,Department of Planning,False,AU,Australia
ent:cf16416e7e15f854,Authority,"Department of the Environment, Climate and Communications",department of the environment climate and communications,True,41.Circular_Economy_Guidance_for_the_Irish_Construction_Sector_For_peer_review_5.9.2023_::c59::a93bc17b7f5d2c11,41.Circular Economy Guidance for the Irish Construction Sector (For peer review) (5.9.2023).pdf,,"Department of the Environment, Climate and Communications Department of Housing, Local Government and Heritage",1,"Department of the Environment, Climate and Communications",False,AU,Australia
ent:fac149a3947503ac,Authority,Design Institute of Australia (DIA),design institute of australia (dia),True,87.The_Circular_Economy_in_the_Australian_Built_Environment_The_State_of_Play_and_a_Research_Agenda::c116::1761486bf37a971b,87.The Circular Economy in the Australian Built Environment The State of Play and a Research Agenda.pdf,,Design Institute of Australia (DIA). 2021. Designers for a Circular Economy … DIA's new policy.,1,Design Institute of Australia (DIA),False,AU,Australia
ent:e9d453e1e02b3849,Authority,Dutch Green Building Council (DGBC),dutch green building council (dgbc),True,70.The_Reuse_Playbook_-_Circular_Buildings_design::c37::e708cd894362678a,70.The Reuse Playbook - Circular Buildings design.pdf,29.0,Level(s) DGBC - Circular Buildings Project Reference Quay Quarter Tower,1,Dutch Green Building Council (DGBC),False,AU,Australia
ent:5a0b2e832ae6aa6e,Authority,Engineers Australia,engineers australia,True,38.AHURI-Final-Report-402-Building-materials-in-a-circular-economy::c259::9d4b12e1927577ff,38.AHURI-Final-Report-402-Building-materials-in-a-circular-economy.pdf,,"EA (2021) Our position on climate change, Engineers Australia, accessed 1 May 2023",3,Engineers Australia,False,AU,Australia
ent:ed56af9fe354a6a5,Authority,Enterprise Ireland,enterprise ireland,True,41.Circular_Economy_Guidance_for_the_Irish_Construction_Sector_For_peer_review_5.9.2023_::c138::215b621a68e75b9e,41.Circular Economy Guidance for the Irish Construction Sector (For peer review) (5.9.2023).pdf,,through Enterprise Ireland or similar training providers,1,Enterprise Ireland,False,AU,Australia
ent:4ba1927fad9748c2,Authority,Environment and Communications Committee,environment and communications committee,True,50.Australia_s_circular_economy_Unlocking_the_oppertunities_Inquiry_report::c133::2eb612be2f4da905,50.Australia’s circular economy Unlocking the oppertunities Inquiry report.pdf,41.0,"Environment and Communications Committee 2025, pp. 68–69",1,Environment and Communications Committee,False,AU,Australia
ent:659bc083c59fab00,Authority,Environmental Protection Agency (EPA),environmental protection agency (epa),True,41.Circular_Economy_Guidance_for_the_Irish_Construction_Sector_For_peer_review_5.9.2023_::c63::b4c349368bf2c58b,41.Circular Economy Guidance for the Irish Construction Sector (For peer review) (5.9.2023).pdf,,Appropriate State bodies to provide guidance to industry with exemplars showing implementing circular economy principles in case study projects. NSAI EPA,6,Environmental Protection Agency (EPA),False,AU,Australia
ent:b58daff55d98bd04,Authority,European Cement Research Academy,european cement research academy,True,38.AHURI-Final-Report-402-Building-materials-in-a-circular-economy::c259::9d4b12e1927577ff,38.AHURI-Final-Report-402-Building-materials-in-a-circular-economy.pdf,,"CSI/ECRA-Technology Papers 2017, European Cement Research Academy, Dusseldorf and Geneva",2,European Cement Research Academy,False,AU,Australia
ent:b02573a0eeb352d2,Authority,European Commission,european commission,True,28.Development_of_the_circular_economy_design_guidelines_for_the_Australian_built_environment_sector::c81::1dcd228a889ccb5d,28.Development of the circular economy design guidelines for the Australian built environment sector.pdf,,European Commission. Circular Economy Action Plan. 2023. Available online: https://environment.ec.europa.eu/strategy/circular‑economy‑action‑plan_en,4,European Commission,False,AU,Australia
ent:43326125c26978ac,Authority,European Demolition Association,european demolition association,True,71.The_Reuse_Playbook_-_Circular_Buildings_Toolkit::c42::0bc53ff2eb35ef80,71.The Reuse Playbook - Circular Buildings Toolkit.pdf,,European Demolition Association – Circular Economy Working A platform for national demolition associations and demolition Group related contractors and suppliers.,1,European Demolition Association,False,AU,Australia
ent:40911fb32b0608dc,Authority,European Union (EU),european union (eu),True,38.AHURI-Final-Report-402-Building-materials-in-a-circular-economy::c51::521c038f2221401f,38.AHURI-Final-Report-402-Building-materials-in-a-circular-economy.pdf,,In the European Union (EU) CDW accounts for more than a third of all waste.,6,European Union; European Union (EU),False,AU,Australia
ent:3a9a54825f803905,Authority,FCRBE,fcrbe,True,47.gbca-a-practical-guide-to-circular-procurement::c126::bdf24606002a417d,47.gbca-a-practical-guide-to-circular-procurement.pdf,,FCRBE: Reuse Toolkit,1,FCRBE,False,AU,Australia
ent:7e68fe3f00482862,Authority,Federal Government,federal government,True,47.gbca-a-practical-guide-to-circular-procurement::c30::345843b1cff4ed12,47.gbca-a-practical-guide-to-circular-procurement.pdf,,"Released in 2024, the Federal Government's Environmentally Sustainable Procurement policy",1,Federal Government,False,AU,Australia
ent:ff42be2ce756f49b,Authority,French Government,french government,True,50.Australia_s_circular_economy_Unlocking_the_oppertunities_Inquiry_report::c126::9085ccbba1efc488,50.Australia’s circular economy Unlocking the oppertunities Inquiry report.pdf,,"the French Government has introduced a repairability index, which indicates how easily repairable a consumer electronics product is",1,French Government,False,AU,Australia
ent:1ffe04a7d4b96ea1,Authority,GBCA,gbca,True,47.gbca-a-practical-guide-to-circular-procurement::c126::bdf24606002a417d,47.gbca-a-practical-guide-to-circular-procurement.pdf,,GBCA: Green Star construction & demolition waste reporting criteria,3,GBCA,False,AU,Australia
ent:bb0e1fe50e9c44e5,Authority,GlobalABC,globalabc,True,47.gbca-a-practical-guide-to-circular-procurement::c126::bdf24606002a417d,47.gbca-a-practical-guide-to-circular-procurement.pdf,,GlobalABC: Pre-demolition audit – overall guidance document,1,GlobalABC,False,AU,Australia
ent:0f34e22fcdcbae0d,Authority,Green Alliance,green alliance,True,71.The_Reuse_Playbook_-_Circular_Buildings_Toolkit::c236::d75c4681996e1824,71.The Reuse Playbook - Circular Buildings Toolkit.pdf,,"Resource Resilient UK: A Report from the Circular Economy Task Force. London: Green Alliance, 2013",1,Green Alliance,False,AU,Australia
ent:61a4e4a2c0ecaf34,Authority,Green Building Council of Australia (GBCA),green building council of australia (gbca),False,44.The_Transition_to_a_Circular_Built_Environment_in_::c34::c56e7ea2e809ad23,44.The_Transition_to_a_Circular_Built_Environment_in_.pdf,,"Green Building Council of Australia. (2020). Building to bounce back: Together, we can build a sustainable future",5,Green Building Council of Australia; Green Building Council of Australia (GBCA),False,AU,Australia
ent:67b3c2913d5a1783,Authority,Infrastructure Australia,infrastructure australia,True,55.australias-circular-economy-framework-2024::c58::00bffb44496f97f8,55.australias-circular-economy-framework-2024.pdf,,Infrastructure Australia estimates that around 27% of virgin materials used for road projects could be replaced,1,Infrastructure Australia,False,AU,Australia
ent:057fc0c6b5767266,Authority,Infrastructure Sustainability Council of Australia (ISCA),infrastructure sustainability council of australia (isca),False,44.The_Transition_to_a_Circular_Built_Environment_in_::c34::c56e7ea2e809ad23,44.The_Transition_to_a_Circular_Built_Environment_in_.pdf,,Prepared for Infrastructure Sustainability Council of Australia,3,Infrastructure Sustainability Council of Australia; Infrastructure Sustainability Council of Australia (ISCA),False,AU,Australia
ent:d73f66392daac5a8,Authority,Institute of Demolition Engineers,institute of demolition engineers,True,71.The_Reuse_Playbook_-_Circular_Buildings_Toolkit::c85::4e9272121fad372f,71.The Reuse Playbook - Circular Buildings Toolkit.pdf,,"Collaboration across the value chain include industry bodies including ASBP, Institute of Demolition Engineers (IDE)",1,Institute of Demolition Engineers,False,AU,Australia
ent:6f787468690e12a0,Authority,Institute of Public Administration,institute of public administration,False,41.Circular_Economy_Guidance_for_the_Irish_Construction_Sector_For_peer_review_5.9.2023_::c69::ccf77b4884d63070,41.Circular Economy Guidance for the Irish Construction Sector (For peer review) (5.9.2023).pdf,,Develop existing good practice through the Institute of Public Administration 2025,1,Institute of Public Administration,False,AU,Australia
ent:7e9c15377c6c53e9,Authority,Institute of Structural Engineers (IStructE),institute of structural engineers (istructe),True,71.The_Reuse_Playbook_-_Circular_Buildings_Toolkit::c49::41bae40dbbf210cf,71.The Reuse Playbook - Circular Buildings Toolkit.pdf,,Institute of Structural Engineers: 2012 Olympic stadium case study,2,Institute of Structural Engineers (IStructE),False,AU,Australia
ent:0b15d074f9fd67d7,Authority,Institution of Civil Engineers,institution of civil engineers,False,87.The_Circular_Economy_in_the_Australian_Built_Environment_The_State_of_Play_and_a_Research_Agenda::c113::713fdf96f077f9e4,87.The Circular Economy in the Australian Built Environment The State of Play and a Research Agenda.pdf,,Proceedings of the Institution of Civil Engineers – Waste and Resource Management,1,Institution of Civil Engineers,False,AU,Australia
ent:542f91819a4a12c5,Authority,International Living Future Institute,international living future institute,True,48.What-Works-3-For-circular-design-in-the-built-environment::c83::bbb874e090fab487,48.What-Works-3-For-circular-design-in-the-built-environment.pdf,,"The Living Building Challenge (LBC), developed by the International Living Future Institute",1,International Living Future Institute,False,AU,Australia
ent:2633bcf276873795,Authority,International Organization for Standardisation,international organization for standardisation,True,71.The_Reuse_Playbook_-_Circular_Buildings_Toolkit::c236::d75c4681996e1824,71.The Reuse Playbook - Circular Buildings Toolkit.pdf,,"International Organization for Standardisation, ISO 20887:2020 Sustainability in buildings and civil engineering works",1,International Organization for Standardisation,False,AU,Australia
ent:ca4e02018ce9d460,Authority,Landcom,landcom,True,42.feasibility-of-deconstruction::c123::93780f20e0fd1145,42.feasibility-of-deconstruction.pdf,,What the results of this research suggest for Landcom and our zero waste pathway is a need for,3,Landcom,False,AU,Australia
ent:5510b7b622ba9022,Authority,Lifecycle Building Center,lifecycle building center,True,71.The_Reuse_Playbook_-_Circular_Buildings_Toolkit::c179::9a81ebe6a308fda6,71.The Reuse Playbook - Circular Buildings Toolkit.pdf,40.0,"Lifecycle Building Center. Design for Deconstruction. Lifecycle Building Center, 2020.",1,Lifecycle Building Center,False,AU,Australia
ent:fd40b629887d411a,Authority,Local Government,local government,False,41.Circular_Economy_Guidance_for_the_Irish_Construction_Sector_For_peer_review_5.9.2023_::c69::ccf77b4884d63070,41.Circular Economy Guidance for the Irish Construction Sector (For peer review) (5.9.2023).pdf,,creation of basic level training of circular economy principles to local authorities,11,Local Authorities; Local Government; Local authorities,False,AU,Australia
