node_id,entity_type,name,name_norm,is_registry,first_seen_chunk,first_seen_source,first_seen_page,example_evidence,chunk_count,surface_forms,is_generic,country,country_full
ent:5ab12cc1a4613542,Instrument,Construction Products Regulation,construction products regulation,False,41.Circular_Economy_Guidance_for_the_Irish_Construction_Sector_For_peer_review_5.9.2023_::c29::697f935e1704356e,41.Circular Economy Guidance for the Irish Construction Sector (For peer review) (5.9.2023).pdf,,the Construc/on Products Regula/on support and require increased applica/on of circular construc/on,1,Construction Products Regulation,False,AU,Australia
ent:b21841beee8cbd52,Instrument,Construction Waste Management Policies,construction waste management policies,True,62.Integrating_the_circular_economy_into_construction_waste_management_in_NSW_Australia::c94::84f2478e7092298d,"62.Integrating the circular economy into construction waste management in NSW, Australia.pdf",39.0,Construction Waste Management policies could be enhanced in two critical areas as it currently fails to address the circular economy goals,3,Construction Waste Management Policies,False,AU,Australia
ent:d358f2a91d5f8aff,Instrument,Construction Works Management Framework,construction works management framework,False,41.Circular_Economy_Guidance_for_the_Irish_Construction_Sector_For_peer_review_5.9.2023_::c160::5579b3b668b91e90,41.Circular Economy Guidance for the Irish Construction Sector (For peer review) (5.9.2023).pdf,,The Construction Works Management Framework has been reformed as per the NDP,1,Construction Works Management Framework,False,AU,Australia
ent:b61aa07791d93ec0,Instrument,container deposit schemes,container deposit schemes,True,52.Circular-Economy-Markets-Australia-_ARUP::c221::9e7c2f1023d591df,52.Circular-Economy-Markets-Australia- ARUP.pdf,,Support for nation-wide education initiatives such as textile repair workshops for the community or in schools or campaigns for container deposit schemes,1,Container Deposit Schemes,False,AU,Australia
ent:310e79b5335a4565,Instrument,Corporate Sustainability Reporting Directive (CSRD),corporate sustainability reporting directive (csrd),True,71.The_Reuse_Playbook_-_Circular_Buildings_Toolkit::c231::4ceac9842017daef,71.The Reuse Playbook - Circular Buildings Toolkit.pdf,52.0,"Corporate Sustainability Reporting Directive (CSRD) applies to large companies or listed EU companies and mandates reporting on resource consumption, use of reused materials",1,Corporate Sustainability Reporting Directive (CSRD),False,AU,Australia
ent:da68190c3f0efbd8,Instrument,Council Policies,council policies,True,72.Circular-Precincts-Australia-1::c73::59810c13463df62c,72.Circular-Precincts-Australia-1.pdf,,"sharing, and supportive council policies",2,Council Policies,False,AU,Australia
ent:d230b2f76fe89928,Instrument,Cradle to Cradle (C2C),cradle to cradle (c2c),True,71.The_Reuse_Playbook_-_Circular_Buildings_Toolkit::c183::06d3bb717ad8170a,71.The Reuse Playbook - Circular Buildings Toolkit.pdf,,Guideline for Building Services Design Inspired by the Cradle to Cradle Concept,1,Cradle to Cradle (C2C),False,AU,Australia
ent:3baf2e9c41b74c82,Instrument,CRC Projects selection round,crc projects selection round,True,87.The_Circular_Economy_in_the_Australian_Built_Environment_The_State_of_Play_and_a_Research_Agenda::c121::0420140167796072,87.The Circular Economy in the Australian Built Environment The State of Play and a Research Agenda.pdf,55.0,CRC Projects selection round outcomes. 2021.,1,CRC Projects selection round,False,AU,Australia
ent:60b8d982d8c05717,Instrument,Deconstruction Plan,deconstruction plan,True,71.The_Reuse_Playbook_-_Circular_Buildings_Toolkit::c175::7cae4a2233c0eef0,71.The Reuse Playbook - Circular Buildings Toolkit.pdf,39.0,"it is essential to create a deconstruction plan. This document provides guidance to future contractors on how deconstruction can be achieved safely, efficiently",5,Deconstruction Plan,False,AU,Australia
ent:2f359a766b36e019,Instrument,Demolition Decision Making Framework,demolition decision making framework,True,42.feasibility-of-deconstruction::c123::93780f20e0fd1145,42.feasibility-of-deconstruction.pdf,,A demolition decision making framework that can identify key considerations to help maximise the reuse of construction materials,1,Demolition Decision Making Framework,False,AU,Australia
ent:3752aad1dedcfbaa,Instrument,Demolition Levy,demolition levy,True,40.CIOB_Response_to_DECC_Circular_Economy_Consultation::c13::afbb99fe681ef433,40.CIOB Response to DECC Circular Economy Consultation.pdf,,following our proposal for a demolition levy in Scotland,1,Demolition Levy,False,AU,Australia
ent:98ae6cc52eb403bd,Instrument,Design Codes,design codes,True,72.Circular-Precincts-Australia-1::c74::5c64cd5c945dbad5,72.Circular-Precincts-Australia-1.pdf,,Ensure State/Territory planning regulations and design codes enable circular outcomes,1,Design Codes,False,AU,Australia
ent:bb135f47fdce020b,Instrument,Design Documents,design documents,True,71.The_Reuse_Playbook_-_Circular_Buildings_Toolkit::c204::fe00e1573460df4f,71.The Reuse Playbook - Circular Buildings Toolkit.pdf,,"Design documents (e.g. drawings)detailing items to be retained in place, deconstructed to be stored for reuse on site",2,Design Documents,False,AU,Australia
ent:7762deb67ba92153,Instrument,Design Drawings with Deconstructable Elements,design drawings with deconstructable elements,True,71.The_Reuse_Playbook_-_Circular_Buildings_Toolkit::c205::8b2fc0ef9f6a6191,71.The Reuse Playbook - Circular Buildings Toolkit.pdf,,"Design drawings with deconstructable elements clearly highlighted, or specification detailing connections/fixings",2,Design Drawings with Deconstructable Elements,False,AU,Australia
ent:7f48f533ca19400e,Practice,Design for Disassembly (DfD),design for disassembly (dfd),True,28.Development_of_the_circular_economy_design_guidelines_for_the_Australian_built_environment_sector::c29::97ca9f6646658b40,28.Development of the circular economy design guidelines for the Australian built environment sector.pdf,,designprinciplessuchasDfDor Designfor deconstruction.Designforreusability Circularitypractices deconstruction/disassembly,29,Design for Deconstruction (DfD),False,AU,Australia
ent:43e91d4ce9d5580b,Instrument,Design for Deconstruction Guide for Building Services,design for deconstruction guide for building services,True,29.Construction_and_Demolition_Waste_Guide_Recycling_and_Re-use_Across_the_Supply_Chain::c102::be9477df60bdf835,29.Construction and Demolition Waste Guide Recycling and Re-use Across the Supply Chain.pdf,,A link to resources on design for deconstruction is given in the resources section of this guide,3,Design for Deconstruction Guide for Building Services,False,AU,Australia
ent:1c7e432a9ef631ec,Instrument,Design for Deconstruction: Practical Guide,design for deconstruction practical guide,True,71.The_Reuse_Playbook_-_Circular_Buildings_Toolkit::c183::06d3bb717ad8170a,71.The Reuse Playbook - Circular Buildings Toolkit.pdf,,UK Green Building Council. Design for Deconstruction: Practical Guide. UK Green Building Council,1,Design for Deconstruction: Practical Guide,False,AU,Australia
ent:6e766dc250897965,Instrument,Development of state of the art techniques in cement manufacturing,development of state of the art techniques in cement manufacturing,True,38.AHURI-Final-Report-402-Building-materials-in-a-circular-economy::c259::9d4b12e1927577ff,38.AHURI-Final-Report-402-Building-materials-in-a-circular-economy.pdf,,"ECRA and CSI (2017) Development of state of the art techniques in cement manufacturing: trying to look ahead, Revision 2017",2,Development of state of the art techniques in cement manufacturing,False,AU,Australia
ent:d05f4668fc4e3479,Instrument,Development Plans,development plans,True,41.Circular_Economy_Guidance_for_the_Irish_Construction_Sector_For_peer_review_5.9.2023_::c179::239773f8c9d0265b,41.Circular Economy Guidance for the Irish Construction Sector (For peer review) (5.9.2023).pdf,74.0,Local authorities should evaluate their own development plans in terms of resource consumption,3,Development Plans,False,AU,Australia
ent:b4707f20cc4a61c2,Instrument,DGNB TEC1.6 Ease of Recovery and Recycling,dgnb tec1.6 ease of recovery and recycling,True,70.The_Reuse_Playbook_-_Circular_Buildings_design::c33::5e23e505005d70b8,70.The Reuse Playbook - Circular Buildings design.pdf,26.0,Assessment methodology based on DGNB TEC1.6 Ease of recovery & recycling,1,DGNB TEC1.6 Ease of Recovery and Recycling,False,AU,Australia
ent:8a76c53197a10a84,Instrument,Digital Twin Victoria,digital twin victoria,True,47.gbca-a-practical-guide-to-circular-procurement::c128::6f933bc6f9511d7c,47.gbca-a-practical-guide-to-circular-procurement.pdf,,"Examples include NSW Spatial Digital Twin, Digital Twin Victoria",1,Digital Twin Victoria,False,AU,Australia
ent:bd89cf8ee020af42,Instrument,DIN SPEC 91484,din spec 91484,True,71.The_Reuse_Playbook_-_Circular_Buildings_Toolkit::c13::e2c5dc3ce12cb69a,71.The Reuse Playbook - Circular Buildings Toolkit.pdf,6.0,DIN SPEC 91484 was created in Germany in 2023 to describe a procedure to record building materials,1,DIN SPEC 91484,False,AU,Australia
ent:af8f819b418a3353,Instrument,DIN SPEC 91484 Table 3,din spec 91484 table 3,True,71.The_Reuse_Playbook_-_Circular_Buildings_Toolkit::c80::2de282d3fb79d1b8,71.The Reuse Playbook - Circular Buildings Toolkit.pdf,,DIN SPEC 91484 Table 3,1,DIN SPEC 91484 Table 3,False,AU,Australia
ent:a4424b6d969b572a,Instrument,Disassembly Matrix,disassembly matrix,True,71.The_Reuse_Playbook_-_Circular_Buildings_Toolkit::c177::6051e51cfd5ac648,71.The Reuse Playbook - Circular Buildings Toolkit.pdf,,A disassembly matrix can be used to assess the opportunities for different elements,1,Disassembly Matrix,False,AU,Australia
ent:be3583fbecc124f4,Instrument,Disassembly Plan,disassembly plan,True,47.gbca-a-practical-guide-to-circular-procurement::c55::cdf6fe0122d82889,47.gbca-a-practical-guide-to-circular-procurement.pdf,,Include circularity vision and requirements in project documents and procurement clauses ❑ Complete a Disassembly Plan,7,Disassembly Plan,False,AU,Australia
ent:706e7ae7dc4fd9ab,Instrument,DISRUPT 2,disrupt 2,True,71.The_Reuse_Playbook_-_Circular_Buildings_Toolkit::c85::4e9272121fad372f,71.The Reuse Playbook - Circular Buildings Toolkit.pdf,,"Delivering Innovative Steel ReUse ProjecT (DISRUPT) initiative, led by the Alliance for Sustainable Building Products (ASBP), aims to promote and facilitate the reuse of structural steel",1,DISRUPT 2,False,AU,Australia
ent:49d2b666e77fba79,Instrument,DRAFT National Waste Management Plan for a Digital Data Capturing Environment,draft national waste management plan for a digital data capturing environment,True,41.Circular_Economy_Guidance_for_the_Irish_Construction_Sector_For_peer_review_5.9.2023_::c149::2c4b2e151427008d,41.Circular Economy Guidance for the Irish Construction Sector (For peer review) (5.9.2023).pdf,61.0,DRAFT National Waste Management Plan for a Digital Data Capturing environment,1,DRAFT National Waste Management Plan for a Digital Data Capturing Environment,False,AU,Australia
ent:69abc7735ecf3506,Instrument,Draft Policy for Circular Economy Decision Making,draft policy for circular economy decision making,False,63.Building_A_Circular_Economy::c3::078b8ca86e255077,63.Building A Circular Economy.pdf,3.0,"New South Wales State Government has a draft policy to guide decision making towards a circular economy to deliver positive economic, social and environmental outcomes",1,Draft Policy for Circular Economy Decision Making,False,AU,Australia
ent:6d943984ce5cdff6,Instrument,DRASTIC,drastic,True,71.The_Reuse_Playbook_-_Circular_Buildings_Toolkit::c53::d75fc035cabaef73,71.The Reuse Playbook - Circular Buildings Toolkit.pdf,14.0,as part of the European project DRASTIC (www.drasticproject.eu),1,DRASTIC,False,AU,Australia
ent:002ea47334f88f54,Instrument,Ecolabels,ecolabels,True,47.gbca-a-practical-guide-to-circular-procurement::c128::6f933bc6f9511d7c,47.gbca-a-practical-guide-to-circular-procurement.pdf,,It is important to ensure that both Ecolabels and EPDs comply with relevant International standards.,1,Ecolabels,False,AU,Australia
ent:a2f1715f46d7168c,Instrument,ecologiQ program,ecologiq program,False,50.Australia_s_circular_economy_Unlocking_the_oppertunities_Inquiry_report::c51::1d64515fb900b6ec,50.Australia’s circular economy Unlocking the oppertunities Inquiry report.pdf,19.0,the ecologiQ program has supported the Victorian Government's Recycled First policy to incorporate 3.4 million tonnes of recycled materials in major public infrastructure,1,ecologiQ program,False,AU,Australia
ent:e4159f4f77fe197c,Instrument,Economic Instruments,economic instruments,True,50.Australia_s_circular_economy_Unlocking_the_oppertunities_Inquiry_report::c125::772b79d2dffb1fe2,50.Australia’s circular economy Unlocking the oppertunities Inquiry report.pdf,39.0,Economic instruments – policies that encourage circular behaviours and practices through price signals.,1,Economic Instruments,False,AU,Australia
ent:6f506254d334e8b5,Instrument,EN 1168:2005+A3:2011 Precast Concrete Products – Hollow Core Slabs,en 11682005a32011 precast concrete products  hollow core slabs,True,71.The_Reuse_Playbook_-_Circular_Buildings_Toolkit::c80::2de282d3fb79d1b8,71.The Reuse Playbook - Circular Buildings Toolkit.pdf,,EN 1168:2005+A3:201 Precast concrete products – Hollow core slabs,1,EN 1168:2005+A3:2011 Precast Concrete Products – Hollow Core Slabs,False,AU,Australia
ent:c3b17b750982827a,Instrument,Energy Performance of Buildings Directive (EPBD),energy performance of buildings directive (epbd),True,71.The_Reuse_Playbook_-_Circular_Buildings_Toolkit::c231::4ceac9842017daef,71.The Reuse Playbook - Circular Buildings Toolkit.pdf,52.0,"Energy Performance of Buildings Directive (EPBD) requires the calculation of whole life-cycle EU carbon for new-builds, with limits to be introduced from 2030",1,Energy Performance of Buildings Directive (EPBD),False,AU,Australia
ent:dc4ac4a6eee062d9,Instrument,Engineering for Australia's Circular Economy: A National Strategy,engineering for australias circular economy a national strategy,True,27.Engineering-for-Australias-Circular-Economy-White-Paper-Download::c55::89f4fc96f690368d,27.Engineering-for-Australias-Circular-Economy-White-Paper-Download.pdf,15.0,ENGINEERING FOR AUSTRALIA'S CIRCULAR ECONOMY: A NATIONAL STRATEGY 15 12. CIRCULAR ENGINEERING PILLAR 1: Circular Design & Construction,1,Engineering for Australia's Circular Economy: A National Strategy,False,AU,Australia
ent:18da46de6a6f67fb,Instrument,Environmental Protection Regulation,environmental protection regulation,True,72.Circular-Precincts-Australia-1::c74::5c64cd5c945dbad5,72.Circular-Precincts-Australia-1.pdf,,Ensure Environmental Protection Regulation activates existing powers to recycle and recover safe waste streams,1,Environmental Protection Regulation,False,AU,Australia
ent:ae513958674204a8,Instrument,"Environmental, social, and governance (ESG) frameworks",environmental social and governance (esg) frameworks,True,55.australias-circular-economy-framework-2024::c55::ecef37652be5c3ad,55.australias-circular-economy-framework-2024.pdf,,"financial incentives including environmental, social, and governance (ESG) frameworks recognising retrofitting activities",1,"Environmental, social, and governance (ESG) frameworks",False,AU,Australia
ent:e52582591ac9cfd8,Instrument,Environmentally Sustainable Procurement Policy and Reporting Framework,environmentally sustainable procurement policy and reporting framework,True,27.Engineering-for-Australias-Circular-Economy-White-Paper-Download::c58::1454ad80721a4a35,27.Engineering-for-Australias-Circular-Economy-White-Paper-Download.pdf,16.0,All building and infrastructure projects above a threshold (currently $7.5 million under the Environmentally Sustainable Procurement Policy),6,Environmentally Sustainable Procurement Policy and Reporting Framework; SA Sustainable Procurement; Sustainable Procurement Policy,False,AU,Australia
ent:7747ed55ee92cb39,Instrument,EPA Code of Practice,epa code of practice,False,41.Circular_Economy_Guidance_for_the_Irish_Construction_Sector_For_peer_review_5.9.2023_::c188::2f56443ad3887134,41.Circular Economy Guidance for the Irish Construction Sector (For peer review) (5.9.2023).pdf,78.0,This should be carried out by a qualified and experienced environmental professional following recognised standards such as the EPA Code of Practice and BS10175.,1,EPA Code of Practice,False,AU,Australia
ent:0bb88ca0d2ca1627,Instrument,EPA Guidance,epa guidance,True,41.Circular_Economy_Guidance_for_the_Irish_Construction_Sector_For_peer_review_5.9.2023_::c188::2f56443ad3887134,41.Circular Economy Guidance for the Irish Construction Sector (For peer review) (5.9.2023).pdf,78.0,Prepare a Resource & Waste Management Plan in accordance with the EPA Guidance.,1,EPA Guidance,False,AU,Australia
ent:261ddeb924386eba,Instrument,EPA Licensing,epa licensing,True,72.Circular-Precincts-Australia-1::c70::c4affefc52bdfcac,72.Circular-Precincts-Australia-1.pdf,,"Evolve EPA licensing to enable the cleaning of secondary resources, remanufacturing, composting, use of secondary resources",1,EPA Licensing,False,AU,Australia
ent:f50556de6843bf71,Instrument,EPR schemes,epr schemes,True,92.Transformation_towards_a_circular_economy_in_the_Australian_construction_and_demolition_waste_management_system::c58::b4b7a67913deb585,92.Transformation towards a circular economy in the Australian construction and demolition waste management system.pdf,35.0,Pushing EPR schemes,1,EPR schemes,False,AU,Australia
ent:1902360685a81e57,Instrument,EU Circular Design Regulations,eu circular design regulations,False,27.Engineering-for-Australias-Circular-Economy-White-Paper-Download::c102::9527733292a41f72,27.Engineering-for-Australias-Circular-Economy-White-Paper-Download.pdf,,"the EU is introducing new circular design regulations, and international standards (ISO 59000 series) now provide common frameworks.",1,EU Circular Design Regulations,False,AU,Australia
ent:3de8ab69655d32be,Instrument,EU Construction & Demolition Waste Management Protocol,eu construction  demolition waste management protocol,True,41.Circular_Economy_Guidance_for_the_Irish_Construction_Sector_For_peer_review_5.9.2023_::c27::d77dc9df4c43842d,41.Circular Economy Guidance for the Irish Construction Sector (For peer review) (5.9.2023).pdf,,EU Construction & Demolition Waste Management Protocol: https://ec.europa.eu/docsroom/documents/20509,2,Construction and Demolition Waste Management Protocol; EU Construction & Demolition Waste Management Protocol,False,AU,Australia
ent:a809a39678aae076,Instrument,EU Level(s) Indicator 2.4 Design for Deconstruction,eu level(s) indicator 2.4 design for deconstruction,True,70.The_Reuse_Playbook_-_Circular_Buildings_design::c33::5e23e505005d70b8,70.The Reuse Playbook - Circular Buildings design.pdf,26.0,"Ease of Recovery + Ease of Reuse and Recycling Scoring, defined as per EU Level(s) Indicator 2.4 Design for Deconstruction",1,EU Level(s) Indicator 2.4 Design for Deconstruction,False,AU,Australia
ent:ce8e25cf470b05de,Instrument,EU Level(s) Macro Objective 2: Resource efficient and circular material life cycles,eu level(s) macro objective 2 resource efficient and circular material life cycles,True,41.Circular_Economy_Guidance_for_the_Irish_Construction_Sector_For_peer_review_5.9.2023_::c41::071ef31f01ad8b91,41.Circular Economy Guidance for the Irish Construction Sector (For peer review) (5.9.2023).pdf,,EU Level(s) Macro Objective 2: Resource efficient and circular material life cycles.,1,EU Level(s) Macro Objective 2: Resource efficient and circular material life cycles,False,AU,Australia
ent:15cc7791db0684bf,Instrument,EU Regulation,eu regulation,True,52.Circular-Economy-Markets-Australia-_ARUP::c225::9e7c2f1023d591df,52.Circular-Economy-Markets-Australia- ARUP.pdf,,"design for disassembly, aligning with EU regulation where possible",2,EU Regulation,False,AU,Australia
ent:9671fa472eccf596,Instrument,EU Sectoral Legislation,eu sectoral legislation,False,41.Circular_Economy_Guidance_for_the_Irish_Construction_Sector_For_peer_review_5.9.2023_::c29::697f935e1704356e,41.Circular Economy Guidance for the Irish Construction Sector (For peer review) (5.9.2023).pdf,,"In terms of EU sectoral legisla/on, the Construc/on Products Regula/on support and require increased applica/on of circular construc/on",1,EU Sectoral Legislation,False,AU,Australia
ent:563fd4658b30d6ad,Instrument,EU Taxonomy,eu taxonomy,True,70.The_Reuse_Playbook_-_Circular_Buildings_design::c53::4b88e458394feca2,70.The Reuse Playbook - Circular Buildings design.pdf,,"Refer to exisiting frameworks/guidelines such as the EU Taxonomy, the LETI and pre-existing targets for the project",2,EU Taxonomy,False,AU,Australia
ent:95e674fb24c68c0a,Instrument,EU Waste Framework Directive,eu waste framework directive,False,41.Circular_Economy_Guidance_for_the_Irish_Construction_Sector_For_peer_review_5.9.2023_::c26::2100d9e00c991bde,41.Circular Economy Guidance for the Irish Construction Sector (For peer review) (5.9.2023).pdf,11.0,The EU Waste Framework Directive (Directive 2008/98/EC) set the basic concepts and definitions related to waste management,1,EU Waste Framework Directive,False,AU,Australia
ent:95c626d41cff1ad5,Instrument,Extended producer responsibility in the Australian construction industry,extended producer responsibility in the australian construction industry,True,31.Are_Australian_Construction_and_Demolition_Waste_Management_Research_Efforts_Coherent_with_Policy_Targets::c53::467fad61ca3d95a8,31.Are Australian Construction and Demolition Waste Management Research Efforts Coherent with Policy Targets.pdf,,"Shooshtarian S, Maqsood T, Wong PSP, Khalfan M, Yang RJ (2021) Extended producer responsibility in the Australian construction industry",1,Extended producer responsibility in the Australian construction industry,False,AU,Australia
ent:ad265a7709dff928,Instrument,Future Transport Strategy 2056,future transport strategy 2056,False,91.A_case_study_of_construction_and_demolition_waste_management_process_flow_in_mega_infrastructure_projects_in_Australia::c35::ac684415a7d822f7,91.A case study of construction and demolition waste management process flow in mega infrastructure projects in Australia.pdf,,Transport for NSW 2018 Future Transport Strategy 2056 NSW Australia: Transport for NSW,1,Future Transport Strategy 2056,False,AU,Australia
ent:6d4f3d75ec880b1b,Instrument,Futures Trading model,futures trading model,True,71.The_Reuse_Playbook_-_Circular_Buildings_Toolkit::c33::76d5ede518d2534f,71.The Reuse Playbook - Circular Buildings Toolkit.pdf,11.0,"ensuring value retention of the deconstructed materials (e.g., through a Futures Trading model), will encourage deconstruction with care.",1,Futures Trading model,False,AU,Australia
ent:c6539950d8961d93,Instrument,GLA guidance,gla guidance,True,71.The_Reuse_Playbook_-_Circular_Buildings_Toolkit::c10::746895024e138a5f,71.The Reuse Playbook - Circular Buildings Toolkit.pdf,,Framework follows CE hierarchy (Figure 3): GLA guidance (best practise and region agnostic),1,GLA guidance,False,AU,Australia
ent:11b736ade33e0006,Instrument,Governance model,governance model,True,72.Circular-Precincts-Australia-1::c70::c4affefc52bdfcac,72.Circular-Precincts-Australia-1.pdf,,"Developing a Governance model to activate, deliver, manage and monitor and replicate circular precincts",1,Governance model,False,AU,Australia
ent:a03858c3bc96f406,Instrument,Government Policies,government policies,True,31.Are_Australian_Construction_and_Demolition_Waste_Management_Research_Efforts_Coherent_with_Policy_Targets::c38::fe197d55aecae315,31.Are Australian Construction and Demolition Waste Management Research Efforts Coherent with Policy Targets.pdf,,Studies fully aligned with government policies typically demonstrate the successful implementation of circular economy principles that meet policy objectives.,13,Government Policies,False,AU,Australia
ent:0f5b3da5a89d9cc0,Instrument,Government Procurement Policies for Major Transport Projects,government procurement policies for major transport projects,True,49.RV_Circular-Economy-Market-Report-2025_2::c36::e011b614e2af612e,49.RV_Circular-Economy-Market-Report-2025_2.pdf,,new government procurement policies for major transport projects to optimise the use of recycled and reused Victorian material,1,Government Procurement Policies for Major Transport Projects,False,AU,Australia
ent:af61a453da7ca9bf,Instrument,Greater London Authority (GLA) London Plan Policies SI2 and SI7,greater london authority (gla) london plan policies si2 and si7,True,71.The_Reuse_Playbook_-_Circular_Buildings_Toolkit::c231::4ceac9842017daef,71.The Reuse Playbook - Circular Buildings Toolkit.pdf,52.0,Greater London Authority (GLA) London Plan Policies SI2 and SI7 addressing whole life carbon London policy and circular economy,1,Greater London Authority (GLA) London Plan Policies SI2 and SI7,False,AU,Australia
ent:401d575615e72379,Instrument,Green Public Procurement (GPP),green public procurement (gpp),True,41.Circular_Economy_Guidance_for_the_Irish_Construction_Sector_For_peer_review_5.9.2023_::c29::697f935e1704356e,41.Circular Economy Guidance for the Irish Construction Sector (For peer review) (5.9.2023).pdf,,mandatory Green Public Procurement (GPP) criteria and targets in sectoral legisla/on and phase in compulsory repor/ng to monitor the uptake of GPP,1,Green Public Procurement (GPP),False,AU,Australia
ent:b745b043c1878c0f,Instrument,Green Star,green star,True,47.gbca-a-practical-guide-to-circular-procurement::c60::0d8e09154502aa98,47.gbca-a-practical-guide-to-circular-procurement.pdf,22.0,Targeting 6 Star Green Star – Buildings v1,4,Green Star,False,AU,Australia
