node_id,entity_type,name,name_norm,is_registry,first_seen_chunk,first_seen_source,first_seen_page,example_evidence,chunk_count,surface_forms,is_generic,country,country_full
ent:fe385b3177a15950,MaterialAsset,Recycling and Resource Recovery Infrastructure,recycling and resource recovery infrastructure,True,41.Circular_Economy_Guidance_for_the_Irish_Construction_Sector_For_peer_review_5.9.2023_::c150::010246e2fb28c993,41.Circular Economy Guidance for the Irish Construction Sector (For peer review) (5.9.2023).pdf,,Develop recycling and resource recovery infrastructure to facilitate the separation and processing of materials for reuse and recycling.,1,Recycling and Resource Recovery Infrastructure,False,AU,Australia
ent:3d40a26d8db16352,MaterialAsset,Recycling Facilities,recycling facilities,True,23.The_Current_State_and_Digital_Evolution_of_the_Demolition_Industry_in_NSW_and_QLD_Australia::c5::f1d0f2f493821b19,"23.The Current State and Digital Evolution of the Demolition Industry in NSW and QLD, Australia.pdf",,"salvage materials (metals, concrete, timber) and collaborate with recycling facilities",8,Recycling Facilities; Recycling Infrastructure,False,AU,Australia
ent:7290eb796c66332c,MaterialAsset,Reinforced structures,reinforced structures,True,71.The_Reuse_Playbook_-_Circular_Buildings_Toolkit::c47::8c778dff8233d89b,71.The Reuse Playbook - Circular Buildings Toolkit.pdf,,e.g. costly deconstruction of reinforced structures,1,Reinforced structures,False,AU,Australia
ent:3e024bc210a2468f,MaterialAsset,Remanufactured Elements,remanufactured elements,True,63.Building_A_Circular_Economy::c3::078b8ca86e255077,63.Building A Circular Economy.pdf,3.0,the building code will need to be updated to allow the use of remanufactured elements and greater quantities of recycled content in building materials,1,Remanufactured Elements,False,AU,Australia
ent:131d5721860e312c,MaterialAsset,Renewable Materials,renewable materials,True,52.Circular-Economy-Markets-Australia-_ARUP::c27::b45757d6ef0fedef,52.Circular-Economy-Markets-Australia- ARUP.pdf,,"renewable resources, t easily broken down at end of life with no toxins/ pollutants",5,Renewable Materials,False,AU,Australia
ent:58529bdc6675194b,MaterialAsset,Residential Buildings,residential buildings,True,38.AHURI-Final-Report-402-Building-materials-in-a-circular-economy::c292::7e312af4f612758a,38.AHURI-Final-Report-402-Building-materials-in-a-circular-economy.pdf,,This formed 18.1% of Australia's total emissions in that year. Residential building was,3,Residential Buildings,False,AU,Australia
ent:2aa6e5c5d7d4e0ca,MaterialAsset,Residential Housing System,residential housing system,True,38.AHURI-Final-Report-402-Building-materials-in-a-circular-economy::c24::b3d9759f103360e3,38.AHURI-Final-Report-402-Building-materials-in-a-circular-economy.pdf,,The focus of the project is the flow of building materials into and out of the residential housing system.,4,Residential Housing System,False,AU,Australia
ent:35aad63163e239a7,MaterialAsset,Residual Waste,residual waste,True,68.ACT-Circular-Economy-Strategy-access::c10::9f7a775e109ea0e6,68.ACT-Circular-Economy-Strategy-access.pdf,,As we transition towards a circular economy the safe disposal of residual waste via landfill will still be necessary,1,Residual Waste,False,AU,Australia
ent:53719bfd165af229,MaterialAsset,Reusable boxes and bags,reusable boxes and bags,True,71.The_Reuse_Playbook_-_Circular_Buildings_Toolkit::c52::1eb62d3bcfe488db,71.The Reuse Playbook - Circular Buildings Toolkit.pdf,,the provision of reusable boxes and bags for both reuse and recycling,1,Reusable boxes and bags,False,AU,Australia
ent:5ec698dbe79e8235,MaterialAsset,Reusable Building Components,reusable building components,True,87.The_Circular_Economy_in_the_Australian_Built_Environment_The_State_of_Play_and_a_Research_Agenda::c50::3f4d7cf3abcbefed,87.The Circular Economy in the Australian Built Environment The State of Play and a Research Agenda.pdf,,establish a virtual building materials bank as a marketplace for reusable building components,1,Reusable Building Components,False,AU,Australia
ent:c6fd774716dc817e,MaterialAsset,Reused Components,reused components,True,27.Engineering-for-Australias-Circular-Economy-White-Paper-Download::c44::a6564a901afc7d8b,27.Engineering-for-Australias-Circular-Economy-White-Paper-Download.pdf,,Regulatory and standards barriers create uncertainty over using high recycled content or reused components,1,Reused Components,False,AU,Australia
ent:ba7ead5c35c7bc9a,MaterialAsset,Reused Materials,reused materials,True,47.gbca-a-practical-guide-to-circular-procurement::c84::7136d342bd02f36b,47.gbca-a-practical-guide-to-circular-procurement.pdf,31.0,Integrate reused materials and ensure compatibility with new components,2,Reused Materials,False,AU,Australia
ent:ebcbf13a1a25073b,MaterialAsset,Reused Products,reused products,True,87.The_Circular_Economy_in_the_Australian_Built_Environment_The_State_of_Play_and_a_Research_Agenda::c101::2c3cd19070c04007,87.The Circular Economy in the Australian Built Environment The State of Play and a Research Agenda.pdf,,"overcome the stigma attached to reused products and to build the confidence of end-users, designers, architects and clients",1,Reused Products,False,AU,Australia
ent:39e12159405b93e3,MaterialAsset,Road Base,road base,True,21.Waste-Feasibility-Study_roadmap::c43::e28639f01a2db346,21.Waste-Feasibility-Study_roadmap.pdf,,"include aggregates for use in road base, and as a sand replacement in sand blasters",7,Road Base,False,AU,Australia
ent:1460b054726f741b,MaterialAsset,Roof Tiles,roof tiles,True,42.feasibility-of-deconstruction::c122::e4aad420b49654c0,42.feasibility-of-deconstruction.pdf,44.0,brick and tile comprised the bulk of volume by weight (58% and 30% respectively),3,Roof Tiles,False,AU,Australia
ent:33cf47c6c8b2ccbc,MaterialAsset,Roofs,roofs,True,47.gbca-a-practical-guide-to-circular-procurement::c63::e59e5acdc9033343,47.gbca-a-practical-guide-to-circular-procurement.pdf,24.0,"Façade / envelope (windows, doors, roofs, cladding)",1,Roofs,False,AU,Australia
ent:9adc4f356b2cc767,MaterialAsset,Salvaged Components,salvaged components,True,23.The_Current_State_and_Digital_Evolution_of_the_Demolition_Industry_in_NSW_and_QLD_Australia::c108::7102bf7e19f715dd,"23.The Current State and Digital Evolution of the Demolition Industry in NSW and QLD, Australia.pdf",,"benefit from digital tools (for instance, material inventories and marketplaces for salvaged components)",3,Salvaged Components,False,AU,Australia
ent:01492bf086e28aae,MaterialAsset,Schools,schools,True,27.Engineering-for-Australias-Circular-Economy-White-Paper-Download::c63::0a3fe90723889627,27.Engineering-for-Australias-Circular-Economy-White-Paper-Download.pdf,,Asset Class Circular Design Strategies... Schools / Hospitals,4,Schools,False,AU,Australia
ent:fa13f2399171a9f4,MaterialAsset,Secondary Aggregates,secondary aggregates,True,41.Circular_Economy_Guidance_for_the_Irish_Construction_Sector_For_peer_review_5.9.2023_::c195::76c343f24e6c6410,41.Circular Economy Guidance for the Irish Construction Sector (For peer review) (5.9.2023).pdf,,secondary aggregates. Government and Local Government to consider updated training for building regula/on and fire cer/fica/on teams on materials reuse and secondary products.,1,Secondary Aggregates,False,AU,Australia
ent:12b15841523e9054,MaterialAsset,Secondary Concrete,secondary concrete,True,55.australias-circular-economy-framework-2024::c58::00bffb44496f97f8,55.australias-circular-economy-framework-2024.pdf,,Priority materials that will significantly lift national recycling rates and reduce material footprint include secondary concrete and steel,1,Secondary Concrete,False,AU,Australia
ent:0409c12966b5429b,MaterialAsset,Secondary Products,secondary products,True,41.Circular_Economy_Guidance_for_the_Irish_Construction_Sector_For_peer_review_5.9.2023_::c195::76c343f24e6c6410,41.Circular Economy Guidance for the Irish Construction Sector (For peer review) (5.9.2023).pdf,,consider updated training for building regula/on and fire cer/fica/on teams on materials reuse and secondary products.,7,Secondary Products,False,AU,Australia
ent:9c158429e14c797e,MaterialAsset,Secondary Raw Materials,secondary raw materials,True,41.Circular_Economy_Guidance_for_the_Irish_Construction_Sector_For_peer_review_5.9.2023_::c27::d77dc9df4c43842d,41.Circular Economy Guidance for the Irish Construction Sector (For peer review) (5.9.2023).pdf,,definitions for when waste ceases to be waste and becomes a secondary raw material (end-of-waste criteria),3,Secondary Raw Materials,False,AU,Australia
ent:3bf7e62e49acb14a,MaterialAsset,Secondary Resources,secondary resources,True,72.Circular-Precincts-Australia-1::c70::c4affefc52bdfcac,72.Circular-Precincts-Australia-1.pdf,,"enable the cleaning of secondary resources, remanufacturing, composting, use of secondary resources in facilities and precincts",1,Secondary Resources,False,AU,Australia
ent:1644e5a8b2f630d6,MaterialAsset,Sewer System,sewer system,True,44.The_Transition_to_a_Circular_Built_Environment_in_::c36::5573267d0f2b37c2,44.The_Transition_to_a_Circular_Built_Environment_in_.pdf,,"drilling activities are discharged into the sewer system, which is not suited to handle such discharges",2,Sewer System,False,AU,Australia
ent:e4a7a0d218340ab9,MaterialAsset,Single Stream Material,single stream material,True,41.Circular_Economy_Guidance_for_the_Irish_Construction_Sector_For_peer_review_5.9.2023_::c200::24b8c1cb868c3b16,41.Circular Economy Guidance for the Irish Construction Sector (For peer review) (5.9.2023).pdf,,for use directly on-site or directly off site particularly for selectively demolished single stream material,2,Single Stream Material,False,AU,Australia
ent:f79be7ee3c5b041e,MaterialAsset,Site-Won Asphalt,site-won asphalt,True,41.Circular_Economy_Guidance_for_the_Irish_Construction_Sector_For_peer_review_5.9.2023_::c181::2345d9d0c3c62dbe,41.Circular Economy Guidance for the Irish Construction Sector (For peer review) (5.9.2023).pdf,75.0,site-won asphalt used as a feedstock to reclaimed asphalt plans,1,Site-Won Asphalt,False,AU,Australia
ent:1ea72af4279db5a4,MaterialAsset,Slag,slag,True,27.Engineering-for-Australias-Circular-Economy-White-Paper-Download::c59::277b0dd18c251b2d,27.Engineering-for-Australias-Circular-Economy-White-Paper-Download.pdf,,"must contain at least 30% supplementary cementitious material (fly ash, slag, etc.)",1,Slag,False,AU,Australia
ent:c8c84d77971022f1,MaterialAsset,Smaller structural sections,smaller structural sections,False,71.The_Reuse_Playbook_-_Circular_Buildings_Toolkit::c51::f83af8e5954acf46,71.The Reuse Playbook - Circular Buildings Toolkit.pdf,,Smaller sections less than 50kg/m were more susceptible to damage,1,Smaller structural sections,False,AU,Australia
ent:e1783faa9c93afa5,MaterialAsset,Social Infrastructure,social infrastructure,True,71.The_Reuse_Playbook_-_Circular_Buildings_Toolkit::c177::6051e51cfd5ac648,71.The Reuse Playbook - Circular Buildings Toolkit.pdf,,"social infrastructure such as hospitals, schools and arts buildings tend to be maintained to extend design life",1,Social Infrastructure,False,AU,Australia
ent:e04d1bae67e874c9,MaterialAsset,Soho Place,soho place,True,71.The_Reuse_Playbook_-_Circular_Buildings_Toolkit::c186::0ef175c84689f556,71.The Reuse Playbook - Circular Buildings Toolkit.pdf,,"The trade-off between design for deconstruction and cost and carbon impacts has been investigated in a study on the design for deconstruction potential of Soho Place (London, UK).",1,Soho Place,False,AU,Australia
ent:3d00018e3508bea8,MaterialAsset,Soil and Stone,soil and stone,True,41.Circular_Economy_Guidance_for_the_Irish_Construction_Sector_For_peer_review_5.9.2023_::c181::2345d9d0c3c62dbe,41.Circular Economy Guidance for the Irish Construction Sector (For peer review) (5.9.2023).pdf,75.0,soil and stone used in landscaping,1,Soil and Stone,False,AU,Australia
ent:544f3ea3ee5cf9b1,MaterialAsset,Space Heating and Cooling Emitters,space heating and cooling emitters,True,71.The_Reuse_Playbook_-_Circular_Buildings_Toolkit::c172::25c535279db8b8bb,71.The Reuse Playbook - Circular Buildings Toolkit.pdf,,"Space heating and cooling emitters (radiators, fan coil units, fan air heater/cooler)",1,Space Heating and Cooling Emitters,False,AU,Australia
ent:0859bab986d6cfd3,MaterialAsset,Staircase banisters,staircase banisters,True,71.The_Reuse_Playbook_-_Circular_Buildings_Toolkit::c105::873e58e7daae3ad4,71.The Reuse Playbook - Circular Buildings Toolkit.pdf,,"markets for windows, doors, staircase banisters, balconies, and alike.",1,Staircase banisters,False,AU,Australia
ent:3e23e57b4994740f,MaterialAsset,Steel,steel,True,27.Engineering-for-Australias-Circular-Economy-White-Paper-Download::c56::64cb3906ab498bf9,27.Engineering-for-Australias-Circular-Economy-White-Paper-Download.pdf,,"demonstrating how major components (steel, facades, etc.) could be recovered at end-of-life.",22,Steel,False,AU,Australia
ent:768c3c6f8ca318c3,MaterialAsset,Steel Beams,steel beams,True,27.Engineering-for-Australias-Circular-Economy-White-Paper-Download::c49::a0147287051385ef,27.Engineering-for-Australias-Circular-Economy-White-Paper-Download.pdf,,reusing steel beams from a building requires assurance of their properties,6,Steel Beams,False,AU,Australia
ent:6981a79907644d22,MaterialAsset,Steel Beams and Columns,steel beams and columns,False,28.Development_of_the_circular_economy_design_guidelines_for_the_Australian_built_environment_sector::c29::97ca9f6646658b40,28.Development of the circular economy design guidelines for the Australian built environment sector.pdf,,elements/componentssuchassteel framesandsteelbeams/columns,1,Steel Beams and Columns,False,AU,Australia
ent:180d441e395b86e2,MaterialAsset,Steel Frames,steel frames,False,28.Development_of_the_circular_economy_design_guidelines_for_the_Australian_built_environment_sector::c29::97ca9f6646658b40,28.Development of the circular economy design guidelines for the Australian built environment sector.pdf,,andreusingbuilding elements/componentssuchassteel framesandsteelbeams/columns,1,Steel Frames,False,AU,Australia
ent:fcc3ce3277e3d793,MaterialAsset,Steel Products,steel products,True,27.Engineering-for-Australias-Circular-Economy-White-Paper-Download::c41::6c2803de9b45308f,27.Engineering-for-Australias-Circular-Economy-White-Paper-Download.pdf,,"engineered timber, steel products, and plasterboard",3,Steel Products,False,AU,Australia
ent:96a987c0ded59ca2,MaterialAsset,Steel Sheet,steel sheet,True,42.feasibility-of-deconstruction::c124::a8bc1030bdf5537e,42.feasibility-of-deconstruction.pdf,,Glass 8% 21% 2% Steel Sheet,1,Steel Sheet,False,AU,Australia
ent:0a8741ebc6731d52,MaterialAsset,Steel Structures,steel structures,True,71.The_Reuse_Playbook_-_Circular_Buildings_Toolkit::c47::8c778dff8233d89b,71.The Reuse Playbook - Circular Buildings Toolkit.pdf,,e.g. Saw steel structures,1,Steel Structures,False,AU,Australia
ent:669ade153a6730a7,MaterialAsset,Stone and Wood Panels,stone and wood panels,True,71.The_Reuse_Playbook_-_Circular_Buildings_Toolkit::c105::873e58e7daae3ad4,71.The Reuse Playbook - Circular Buildings Toolkit.pdf,,"Reuse markets for used bricks, roof tiles, and stone and wood panels are well-established",1,Stone and Wood Panels,False,AU,Australia
ent:6d18593e8e0ce891,MaterialAsset,Structural Steel,structural steel,True,42.feasibility-of-deconstruction::c124::a8bc1030bdf5537e,42.feasibility-of-deconstruction.pdf,,Structural Timber Structural Steel Glass,5,Structural Steel,False,AU,Australia
ent:545a4090402d77d9,MaterialAsset,Surplus pre-consumer stock,surplus pre-consumer stock,True,1.national-waste-and-resource-recovery-report-2024::c106::d40fae0ff55786fe,1.national-waste-and-resource-recovery-report-2024.pdf,,"This includes unwanted business equipment, surplus pre-consumer stock and food, and unwanted post-consumer items.",1,Surplus pre-consumer stock,False,AU,Australia
ent:e2988f18b19351bb,MaterialAsset,Sustainable Building Materials,sustainable building materials,True,41.Circular_Economy_Guidance_for_the_Irish_Construction_Sector_For_peer_review_5.9.2023_::c138::215b621a68e75b9e,41.Circular Economy Guidance for the Irish Construction Sector (For peer review) (5.9.2023).pdf,,"Promote green, sustainable products to clients and procurement agencies in design",3,Sustainable Building Materials,False,AU,Australia
ent:80932e76af31fdb3,MaterialAsset,Sustainably Sourced Timber,sustainably sourced timber,True,27.Engineering-for-Australias-Circular-Economy-White-Paper-Download::c58::1454ad80721a4a35,27.Engineering-for-Australias-Circular-Economy-White-Paper-Download.pdf,16.0,use cross-laminated timber (CLT) or sustainably sourced timber in place of steel or concrete where feasible,1,Sustainably Sourced Timber,False,AU,Australia
ent:8dcb94e81311dd08,MaterialAsset,Test Panel,test panel,False,71.The_Reuse_Playbook_-_Circular_Buildings_Toolkit::c190::70b0f399f46acc28,71.The Reuse Playbook - Circular Buildings Toolkit.pdf,,a test panel was extracted and sent to the University of Surrey for testing,1,Test Panel,False,AU,Australia
ent:5595aab2c1075516,MaterialAsset,The Circular Building,the circular building,True,70.The_Reuse_Playbook_-_Circular_Buildings_design::c37::e708cd894362678a,70.The Reuse Playbook - Circular Buildings design.pdf,29.0,Project Reference The Circular Building,1,The Circular Building,False,AU,Australia
ent:4d523de7ce75293e,MaterialAsset,Timber,timber,True,23.The_Current_State_and_Digital_Evolution_of_the_Demolition_Industry_in_NSW_and_QLD_Australia::c5::f1d0f2f493821b19,"23.The Current State and Digital Evolution of the Demolition Industry in NSW and QLD, Australia.pdf",,"demolition contractors to salvage materials (metals, concrete, timber)",18,Timber,False,AU,Australia
ent:6c7e55be83345e79,MaterialAsset,Timber for Energy Recovery,timber for energy recovery,True,38.AHURI-Final-Report-402-Building-materials-in-a-circular-economy::c130::1ca595ed7369d14e,38.AHURI-Final-Report-402-Building-materials-in-a-circular-economy.pdf,,Timber is burned for energy,2,Timber for Energy Recovery,False,AU,Australia
ent:dbaed818cc5173ee,MaterialAsset,Timber Frames,timber frames,True,70.The_Reuse_Playbook_-_Circular_Buildings_design::c53::4b88e458394feca2,70.The Reuse Playbook - Circular Buildings design.pdf,,"Reuse steel, concrete or timber frames from deconstructed structures",1,Timber Frames,False,AU,Australia
ent:4a4e4b9f78f125ad,MaterialAsset,Timber Joists,timber joists,True,47.gbca-a-practical-guide-to-circular-procurement::c63::e59e5acdc9033343,47.gbca-a-practical-guide-to-circular-procurement.pdf,24.0,"Structural components (steel beams, timber joists, beams etc., concrete slabs)",1,Timber Joists,False,AU,Australia
ent:74111d65bf98e8aa,MaterialAsset,Timber Waste,timber waste,True,29.Construction_and_Demolition_Waste_Guide_Recycling_and_Re-use_Across_the_Supply_Chain::c101::8d366d08a556d30a,29.Construction and Demolition Waste Guide Recycling and Re-use Across the Supply Chain.pdf,,This is particularly the case with the timber waste stream where there is contamination from treated timber products.,1,Timber Waste,False,AU,Australia
ent:8871f5a3894e060b,MaterialAsset,Transport Systems,transport systems,True,71.The_Reuse_Playbook_-_Circular_Buildings_Toolkit::c10::746895024e138a5f,71.The Reuse Playbook - Circular Buildings Toolkit.pdf,,"affect local amenities, the existing transport systems and local infrastructure",1,Transport Systems,False,AU,Australia
ent:d9da65a22dc0f809,MaterialAsset,Ultra-High-Performance Concrete (UHPC),ultra-high-performance concrete (uhpc),True,52.Circular-Economy-Markets-Australia-_ARUP::c165::73ced695446c2f6e,52.Circular-Economy-Markets-Australia- ARUP.pdf,34.0,utilising high strength lower volume options such as ultra-high-performance concrete,1,Ultra-High-Performance Concrete (UHPC),False,AU,Australia
ent:7e6e31336dca8734,MaterialAsset,Unprocessed ferrous scrap metal,unprocessed ferrous scrap metal,True,52.Circular-Economy-Markets-Australia-_ARUP::c131::f5dac0a71da1e892,52.Circular-Economy-Markets-Australia- ARUP.pdf,,including unprocessed ferrous scrap metal in the export ban list,1,Unprocessed ferrous scrap metal,False,AU,Australia
ent:979d06da506108a3,MaterialAsset,Unwanted post-consumer items,unwanted post-consumer items,True,1.national-waste-and-resource-recovery-report-2024::c106::d40fae0ff55786fe,1.national-waste-and-resource-recovery-report-2024.pdf,,"This includes unwanted business equipment, surplus pre-consumer stock and food, and unwanted post-consumer items.",1,Unwanted post-consumer items,False,AU,Australia
ent:72e1b84cf43c4010,MaterialAsset,Upcycled Products,upcycled products,True,31.Are_Australian_Construction_and_Demolition_Waste_Management_Research_Efforts_Coherent_with_Policy_Targets::c23::778a6627f0d8590c,31.Are Australian Construction and Demolition Waste Management Research Efforts Coherent with Policy Targets.pdf,9.0,economic incentives and policies that could foster more favourable market conditions for recycled and upcycled products,1,Upcycled Products,False,AU,Australia
ent:4991407ee9078a3e,MaterialAsset,Valuable Materials,valuable materials,True,31.Are_Australian_Construction_and_Demolition_Waste_Management_Research_Efforts_Coherent_with_Policy_Targets::c22::b555352e2b828dd2,31.Are Australian Construction and Demolition Waste Management Research Efforts Coherent with Policy Targets.pdf,,boosting the recovery rates of valuable materials from,2,Valuable Materials,False,AU,Australia
ent:2efa2e2f2de54ec1,MaterialAsset,Victorian Recycled and Reused Materials,victorian recycled and reused materials,True,49.RV_Circular-Economy-Market-Report-2025_2::c36::e011b614e2af612e,49.RV_Circular-Economy-Market-Report-2025_2.pdf,,optimise the use of recycled and reused Victorian material within allowable limits under existing specifications,2,Victorian Recycled and Reused Materials,False,AU,Australia
ent:b852276b112492bd,MaterialAsset,Virgin Materials,virgin materials,True,41.Circular_Economy_Guidance_for_the_Irish_Construction_Sector_For_peer_review_5.9.2023_::c41::071ef31f01ad8b91,41.Circular Economy Guidance for the Irish Construction Sector (For peer review) (5.9.2023).pdf,,"Use and extraction of raw virgin materials, generation of waste in construction and demolition",10,Virgin Materials,False,AU,Australia
ent:618dd3400c3042ad,MaterialAsset,Walls,walls,True,62.Integrating_the_circular_economy_into_construction_waste_management_in_NSW_Australia::c150::c59830b35eb1d847,"62.Integrating the circular economy into construction waste management in NSW, Australia.pdf",,the constructability requirements of walls that use plasterboard need to be considered,2,Walls,False,AU,Australia
ent:ef788fa7f06fc623,MaterialAsset,Waste Resources,waste resources,True,75.Case-Study-1-1-ATCO-SL::c104::0273753976830c6d,75.Case-Study-1-1-ATCO-SL.pdf,44.0,exploring opportunities to capture the value of waste resources,1,Waste Resources,False,AU,Australia
ent:4251fe4be8798835,MaterialAsset,Waste Sorting and Storage Facilities,waste sorting and storage facilities,True,92.Transformation_towards_a_circular_economy_in_the_Australian_construction_and_demolition_waste_management_system::c58::b4b7a67913deb585,92.Transformation towards a circular economy in the Australian construction and demolition waste management system.pdf,35.0,Improving the availability of intermediate waste sorting and storage facilities,1,Waste Sorting and Storage Facilities,False,AU,Australia
ent:4e2007736292d7e0,MaterialAsset,Waste Streams,waste streams,True,62.Integrating_the_circular_economy_into_construction_waste_management_in_NSW_Australia::c94::84f2478e7092298d,"62.Integrating the circular economy into construction waste management in NSW, Australia.pdf",39.0,"the structure of regulations that regulate construction waste management is not precisely fit for purpose, as the regulations do not focus on individual waste streams",5,Waste Streams,False,AU,Australia
ent:19fb2c700fb16e78,MaterialAsset,Water-damaged drywall,water-damaged drywall,True,71.The_Reuse_Playbook_-_Circular_Buildings_Toolkit::c42::0bc53ff2eb35ef80,71.The Reuse Playbook - Circular Buildings Toolkit.pdf,,Surface / high level condition e.g. Well-maintained steel beams e.g. water-damaged drywall,1,Water-damaged drywall,False,AU,Australia
ent:79554bb6b8ad8ede,MaterialAsset,Whole Assemblies,whole assemblies,True,71.The_Reuse_Playbook_-_Circular_Buildings_Toolkit::c35::aed92bb4152a77a5,71.The Reuse Playbook - Circular Buildings Toolkit.pdf,,Reusing or re-warranting whole assemblies minimizes contamination and reduces processing effort,1,Whole Assemblies,False,AU,Australia
ent:693cc5955b709ea8,MaterialAsset,Whole Tyres,whole tyres,True,27.Engineering-for-Australias-Circular-Economy-White-Paper-Download::c71::78ea271408405967,27.Engineering-for-Australias-Circular-Economy-White-Paper-Download.pdf,19.0,"many jurisdictions have or plan bans on landfilling whole tyres, e-waste, and large batteries – extend that.",3,Whole Tyres,False,AU,Australia
ent:fa1c3f8f8f1a23e5,MaterialAsset,Windows,windows,True,47.gbca-a-practical-guide-to-circular-procurement::c63::e59e5acdc9033343,47.gbca-a-practical-guide-to-circular-procurement.pdf,24.0,"Façade / envelope (windows, doors, roofs, cladding)",3,Windows,False,AU,Australia
ent:dc20a8c11a0073f8,MaterialAsset,Wood,wood,True,38.AHURI-Final-Report-402-Building-materials-in-a-circular-economy::c51::521c038f2221401f,38.AHURI-Final-Report-402-Building-materials-in-a-circular-economy.pdf,,"CDW that consists of various materials such as concrete, bricks, plaster, timber, wood, glass, metals and plastic.",5,Recovered Wood; Wood,False,AU,Australia
